{"schema_version":"pysolate.lab-index.v1","source_sha256":"sha256:3222d98ecec889b156cb3d3919390363150eef947cc361ff5b4d62be7fefc338","generated_at_policy":"omitted","links":[{"rel":"study","kind":"study-summary.v1","sha256":"sha256:148706b874f8623b9e71a99c3f1516c93a2e09bea5983ada11148eb904539edc"},{"rel":"run","kind":"run-detail.v1","sha256":"sha256:c17b3710f6437c63d83ddeccd56ea4ab08463989f2af5f23561baf1876ef50d2"},{"rel":"timeline","kind":"timeline-page.v1","sha256":"sha256:0206f2e33e8f3910559b0a780102ae9c9a5f35779b579e0ff7d54fb4d7c3d139"},{"rel":"branch","kind":"branch-dag.v1","sha256":"sha256:528fce0ee6c62fa4835f981b91bf1fb65dc48a2d80421a86c2153075dddb61b4"},{"rel":"workspace","kind":"workspace-diff.v1","sha256":"sha256:ce38b8bd24b8913f5950da076961819742e8833925315c42247b924a3e8a111d"},{"rel":"comparison","kind":"run-comparison.v1","sha256":"sha256:3a8ab992511a35afd2983fed0b57db111fe8cd52d12259a7f692576fac6619fe"},{"rel":"reference","kind":"object-ref.v1","sha256":"sha256:542f88aefb18cab067c63d62eb5c605b2b4e41dda0733c25474c217a118c5ad1"},{"rel":"problem","kind":"problem.v1","sha256":"sha256:5c204212356f13d163d3babfa47f8d9e3401826ca2adecb937f5f57aa63b899d"}],"capabilities":["branch_dag","comparison","timeline","workspace_diff"],"page":{"cursor":"","next_cursor":"","returned":8,"total":8,"truncated":false}}