{"schema_version":"pysolate.lab-index.v1","source_sha256":"sha256:96471d39c04f3382696a858021bcb83f675f274a6d7de1f2450057e82beec71a","generated_at_policy":"omitted","links":[{"rel":"study","kind":"study-summary.v1","sha256":"sha256:30c2d9bd9e0dbe751f95be1c129766705ea0c4b350f55014d2ebcf779d62c826"},{"rel":"run","kind":"run-detail.v1","sha256":"sha256:9187683c4596bfcc0b2b53f78bf5ebf30122211208edbf5d7941bbf9480f6655"},{"rel":"timeline","kind":"timeline-page.v1","sha256":"sha256:f8c35cb2a688686e317b4c78248ce3696c7aeb60b6065b51b09c86c26a9f9f50"},{"rel":"branch","kind":"branch-dag.v1","sha256":"sha256:f5ac0a5af827bfd09fce5fb1d8bc69497ae97c9af33f2836b45c4973b57dae3c"},{"rel":"workspace","kind":"workspace-diff.v1","sha256":"sha256:4d782101e3752f9d1bc46df0f97162b7780b6a0d240559c383fa26e15df7cfc1"},{"rel":"comparison","kind":"run-comparison.v1","sha256":"sha256:2da9ff184717c3d51b0f6c3a854b2b5f0919f6ccdb9dcabd0104cc7c1fc11cdd"},{"rel":"reference","kind":"object-ref.v1","sha256":"sha256:6bc99e810fa6c2c64ee53ea4d7033e27595a85066eec248857f4ab021b8c934f"},{"rel":"problem","kind":"problem.v1","sha256":"sha256:5868bb80f35c7d53f8e677603cef5a79dea395ffe8278f21ac4fbfe7447af034"}],"capabilities":["branch_dag","comparison","timeline","workspace_diff"],"page":{"cursor":"","next_cursor":"","returned":8,"total":8,"truncated":false}}